{"schema_version":"continuityforge.rcpsp.solution.v2","status":"OPTIMAL","algorithm":"ortools-cp-sat","schedule":[{"task_id":"design","start":0,"finish":2},{"task_id":"procurement","start":1,"finish":4},{"task_id":"prototype","start":4,"finish":8},{"task_id":"documentation","start":2,"finish":4},{"task_id":"validation","start":8,"finish":10},{"task_id":"release","start":10,"finish":11}],"candidates_evaluated":0,"accepted_moves":0,"budget":0,"elapsed_ms":5,"diagnostic":"OR-Tools 9.15.6755; 1 worker; 5s limit","makespan":11,"lower_bound":11}
