{"schema_version":"continuityforge.rcpsp.solution.v2","status":"OPTIMAL","algorithm":"ortools-cp-sat","schedule":[{"task_id":"isolate","start":0,"finish":1},{"task_id":"restore-db","start":1,"finish":5},{"task_id":"restore-cache","start":1,"finish":3},{"task_id":"verify-api","start":5,"finish":7},{"task_id":"smoke","start":7,"finish":8}],"candidates_evaluated":0,"accepted_moves":0,"budget":0,"elapsed_ms":3,"diagnostic":"OR-Tools 9.15.6755; 1 worker; 5s limit","makespan":8,"lower_bound":8}
