{"schema_version":"continuityforge.rcpsp.solution.v2","status":"OPTIMAL","algorithm":"ortools-cp-sat","schedule":[{"task_id":"checkout","start":0,"finish":1},{"task_id":"compile-a","start":1,"finish":5},{"task_id":"compile-b","start":5,"finish":8},{"task_id":"test-a","start":6,"finish":8},{"task_id":"package","start":8,"finish":10},{"task_id":"sign","start":10,"finish":11}],"candidates_evaluated":0,"accepted_moves":0,"budget":0,"elapsed_ms":4,"diagnostic":"OR-Tools 9.15.6755; 1 worker; 5s limit","makespan":11,"lower_bound":11}
